{
  "schema_version": "podcast-1.0",
  "episode": {
    "title_en": "Как построить AI-First компанию",
    "title_ru": "Как построить AI-First компанию",
    "show": "Алексей Остриков",
    "episode_no": null,
    "date": "20260503",
    "youtube_id": "Q7pI3uUwfTI",
    "url": "https://www.youtube.com/watch?v=Q7pI3uUwfTI",
    "duration_seconds": 2904,
    "duration_hhmmss": "00:48:24",
    "captions_kind": "auto",
    "summary_ru": "Эпизод — доклад Алексея о том, как превратить обычную компанию в AI-First: организацию, где узлы бизнес-процессов исполняют агенты, а люди учат их и улучшают. Разбирается вся вертикаль: компания как граф процессов, отказ от hand-coded агентов в пользу общего агентского ядра и бизнес-логики на уровне skills, вайбкодинг скиллов голосом доменными экспертами, Skill Store как механизм переиспользования, путь скилла от локальной песочницы до облачного агента на кроне. Отдельный пласт — люди: чемпионы «2 из 20», пересечение опыта и AI fluency, очеловеченные агент-персоны и риск потери junior-конвейера. Честно проговорены слабые места: evals вместо человека-верификатора, мультипликация ошибок на agent-to-agent handoff, vibe-coding tech debt и стоимость токенов (start expensive, then downshift). Урок стоит выучить, потому что он даёт целостную практическую рамку AI-трансформации компании — от онтологии процессов до кадровой политики и регуляторики.",
    "cover_alt_ru": "Схема компании как графа процессов: в узлах вместо человеческих фигурок стоят маленькие агенты-роботы, а немногочисленные люди сверху настраивают и обучают их; один человек наблюдает за всем из кресла."
  },
  "speakers": [
    {
      "id": "alexey",
      "name": "Алексей Остриков",
      "role": "host",
      "bio_ru": "Разработчик AI-агентов в Яндексе, участник «летучего десанта», внедряющего агентов в бизнес-юниты компании. Автор доклада — результата нескольких месяцев размышлений и экспериментов о том, как превратить компанию в AI-First."
    },
    {
      "id": "timur",
      "name": "Тимур",
      "role": "guest",
      "bio_ru": "Участник из аудитории; поднимает ключевое возражение: людям сложно объяснить свою работу по шагам, поэтому извлечение опыта экспертов в скиллы — самая большая проблема подхода."
    },
    {
      "id": "kostya",
      "name": "Костя",
      "role": "guest",
      "bio_ru": "Участник из аудитории; спрашивает, хватит ли одних скиллов или для критичных процессов придётся модифицировать агентское ядро, и указывает на риск технического долга при массовом вайбкодинге скиллов."
    }
  ],
  "chapters": [
    {
      "t_seconds": 0,
      "title_en": "Presentation outline",
      "title_ru": "План доклада"
    },
    {
      "t_seconds": 56,
      "title_en": "What is an AI-First company?",
      "title_ru": "Что такое AI-First компания?"
    },
    {
      "t_seconds": 157,
      "title_en": "Processes in the prehistoric era",
      "title_ru": "Процессы в доисторическую эпоху"
    },
    {
      "t_seconds": 235,
      "title_en": "Why \"one CEO and a million agents\" won't work",
      "title_ru": "Почему не сработает «один CEO и миллион агентов»"
    },
    {
      "t_seconds": 452,
      "title_en": "The key difference in the current agent development paradigm",
      "title_ru": "Ключевое отличие текущей парадигмы разработки агентов"
    },
    {
      "t_seconds": 568,
      "title_en": "Skills - a concept that changes everything",
      "title_ru": "Skills — концепция, которая меняет всё"
    },
    {
      "t_seconds": 641,
      "title_en": "Business skills: how to vibecode them",
      "title_ru": "Бизнесовые скиллы: как их вайбкодим"
    },
    {
      "t_seconds": 810,
      "title_en": "Why magic doesn't happen immediately after implementing skills",
      "title_ru": "Почему магия не случается сразу после реализации скиллов"
    },
    {
      "t_seconds": 932,
      "title_en": "Elements of the new system: Skill Store, skills, local and cloud agents",
      "title_ru": "Элементы новой системы: Skill Store, скиллы, локальные и облачные агенты"
    },
    {
      "t_seconds": 1284,
      "title_en": "The future of any profession - agent management",
      "title_ru": "Будущее любой профессии — управление агентами"
    },
    {
      "t_seconds": 1333,
      "title_en": "Why will people be needed?",
      "title_ru": "Зачем будут нужны люди?"
    },
    {
      "t_seconds": 1498,
      "title_en": "Who will hold the keys to the new world?",
      "title_ru": "У кого окажутся ключи от нового мира?"
    },
    {
      "t_seconds": 1558,
      "title_en": "Thoughts on human nature",
      "title_ru": "Мысли о человеческой природе"
    },
    {
      "t_seconds": 1654,
      "title_en": "Why humanize AI avatars",
      "title_ru": "Зачем очеловечивать AI-аватары"
    },
    {
      "t_seconds": 1773,
      "title_en": "(Q&A) Will there be a market for AI personalities, and will it be possible to buy an AI accountant for 4 hours a week?",
      "title_ru": "(Q&A) Появится ли рынок AI-личностей и можно ли будет купить AI-бухгалтера на 4 часа в неделю?"
    },
    {
      "t_seconds": 1870,
      "title_en": "Will people want to extract skills from their experience?",
      "title_ru": "Захотят ли люди выделять скиллы из своего опыта?"
    },
    {
      "t_seconds": 2005,
      "title_en": "How to avoid mistakes when transferring work between agents?",
      "title_ru": "Как избежать ошибок при передаче работы между агентами?"
    },
    {
      "t_seconds": 2174,
      "title_en": "What if we have to use only sovereign models?",
      "title_ru": "Что если придётся использовать только суверенные модели?"
    },
    {
      "t_seconds": 2222,
      "title_en": "What if experts invest knowledge in skills and then disappear?",
      "title_ru": "А если эксперты вложат знания в скиллы, а сами потом исчезнут?"
    },
    {
      "t_seconds": 2328,
      "title_en": "Will we have to delve into the core business logic for critical processes?",
      "title_ru": "Не придётся ли лезть в бизнес-логику ядра для критичных процессов?"
    },
    {
      "t_seconds": 2432,
      "title_en": "What to do with technical debt if everyone starts vibecoding skills with their voice?",
      "title_ru": "Что делать с техдолгом, если все начнут вайбкодить скиллы голосом?"
    },
    {
      "t_seconds": 2569,
      "title_en": "Will we go broke on the most expensive models?",
      "title_ru": "Не разоримся ли мы на самых дорогих моделях?"
    },
    {
      "t_seconds": 2664,
      "title_en": "What if a company can't use powerful models?",
      "title_ru": "А если в компании нельзя пользоваться сильными моделями?"
    },
    {
      "t_seconds": 2756,
      "title_en": "Inspections and Regulation in a Brave New World",
      "title_ru": "Проверки и регуляторика в дивном новом мире"
    },
    {
      "t_seconds": 2813,
      "title_en": "What should AI-First company founders do?",
      "title_ru": "Что делать основателям AI-First компаний?"
    },
    {
      "t_seconds": 2878,
      "title_en": "When will the market become saturated with such companies?",
      "title_ru": "Когда рынок насытится такими компаниями?"
    }
  ],
  "sections": [
    {
      "id": "what-is-ai-first",
      "title_en": "What an AI-First Company Is",
      "title_ru": "Что такое AI-First компания",
      "intro_ru": "Алексей Остриков, разработчик агентов в Яндексе из «летучего десанта», внедряющего AI в бизнес-юниты, открывает доклад разминкой с залом: что такое AI-First компания? От ответов аудитории он приходит к базовой рамке: любая компания — это сотни и тысячи процессов, которые исторически исполняли люди. Определение секции: AI-First компания — та, где процессы исполняют агенты, а люди их учат и улучшают.",
      "t_seconds": 0,
      "source_docs": [],
      "concepts": [
        {
          "id": "company-as-processes",
          "term_en": "company as a bundle of processes",
          "explanation_ru": "Отправная точка всей рамки: любая компания — это не оргструктура и не продукт, а сотни, десятки или тысячи процессов. Есть долгие (запуск нового продукта, такси в новой стране), быстрые и закольцованные. Исторически каждый узел такого процесса исполнял человек: люди перекладывают бумажки, анализируют данные, суммаризируют, пишут презентации — «человек-человек-человек». Это удобная декомпозиция, потому что она превращает расплывчатый вопрос «как внедрить AI в компанию» в конкретный: какие узлы каких процессов можно передать агентам. Пока вы видите компанию как людей, автоматизировать нечего; как только видите её как граф процессов — у каждого узла появляется кандидат на замену агентом или LLM workflow.",
          "analogy_ru": "Ресторан — не «повара и официанты», а конвейеры процессов по шагам",
          "speaker_id": "alexey",
          "quote_en": null,
          "quote_provenance": null,
          "visual": {
            "type": "image",
            "component": null,
            "title_ru": "Ресторан — не «повара и официанты», а конвейеры процессов по шагам",
            "image_prompt": "Bird's-eye view of a restaurant drawn as several conveyor lines of people passing plates and paper order slips hand to hand — order taking, purchasing, cooking, serving, cleaning; one line is long and winding, another short and fast, one loops in a circle",
            "cache_filename": "assets/company-as-processes.png",
            "alt_ru": "Офис как множество конвейеров из людей, передающих документы по цепочке",
            "params": null
          },
          "tldr_ru": "Компания — это не люди и оргструктура, а сотни процессов; каждый узел — кандидат на замену агентом или [[LLM|большая языковая модель]] [[workflow|рабочий процесс]].",
          "key_points_ru": [
            "Компания = граф из сотен и тысяч процессов: долгих, быстрых, закольцованных",
            "Исторически каждый узел исполняет человек: «человек-человек-человек»",
            "Декомпозиция превращает «как внедрить AI» в «какие узлы отдать агентам»",